{
  "title": "Brand Hub changelog.json",
  "$schema": "https://json-schema.org/draft/2020-12/schema",
  "type": "array",
  "items": {
    "type": "object",
    "properties": {
      "date": {
        "anyOf": [
          {
            "type": "string",
            "format": "date",
            "pattern": "^(?:(?:\\d\\d[2468][048]|\\d\\d[13579][26]|\\d\\d0[48]|[02468][048]00|[13579][26]00)-02-29|\\d{4}-(?:(?:0[13578]|1[02])-(?:0[1-9]|[12]\\d|3[01])|(?:0[469]|11)-(?:0[1-9]|[12]\\d|30)|(?:02)-(?:0[1-9]|1\\d|2[0-8])))$"
          },
          {
            "type": "string",
            "format": "date-time",
            "pattern": "^(?:(?:\\d\\d[2468][048]|\\d\\d[13579][26]|\\d\\d0[48]|[02468][048]00|[13579][26]00)-02-29|\\d{4}-(?:(?:0[13578]|1[02])-(?:0[1-9]|[12]\\d|3[01])|(?:0[469]|11)-(?:0[1-9]|[12]\\d|30)|(?:02)-(?:0[1-9]|1\\d|2[0-8])))T(?:(?:[01]\\d|2[0-3]):[0-5]\\d:[0-5]\\d(?:\\.\\d+)?(?:Z|([+-](?:[01]\\d|2[0-3]):[0-5]\\d)))$"
          }
        ]
      },
      "assetId": {
        "type": "string",
        "pattern": "^[a-z0-9]+(?:-[a-z0-9]+)*$"
      },
      "assetType": {
        "type": "string",
        "enum": [
          "logo",
          "color",
          "font",
          "icon",
          "template",
          "photo-source",
          "boilerplate",
          "document",
          "rule",
          "signature-layout"
        ]
      },
      "change": {
        "type": "string",
        "enum": [
          "added",
          "updated",
          "retired"
        ]
      },
      "summary": {
        "type": "string",
        "minLength": 1
      },
      "author": {
        "type": "string",
        "minLength": 1
      },
      "revision": {
        "type": "string",
        "minLength": 1
      }
    },
    "required": [
      "date",
      "assetId",
      "assetType",
      "change",
      "summary",
      "author"
    ],
    "additionalProperties": false
  }
}
